{
  "schema_version": "1.0",
  "source": {
    "type": "pull_request",
    "repo": "acme/shop-platform",
    "pr_number": 142,
    "ref": "feature/place-order",
    "base_sha": null,
    "head_sha": null,
    "title": "Add PlaceOrder command handler"
  },
  "summary": "Adds a CQRS command handler that creates an order, saves it with TypeORM, and publishes an order.placed event. The main risk is event consistency: the event can be published for an order that is never committed, and broker failures are silently ignored.",
  "findings": [
    {
      "id": "F01",
      "file": "services/order-service/src/application/commands/place-order.handler.ts",
      "side": "new",
      "line_start": 19,
      "line_end": 27,
      "severity": "high",
      "category": "event-consistency",
      "summary": "Event is published inside the transaction, before commit, and is fire-and-forget",
      "rationale": "The emit call sits inside the dataSource.transaction callback, so order.placed is published before the transaction commits, and its result is neither awaited nor given an error handler. A subscriber can act on the event while the order row is still invisible to other connections, or after a commit that ultimately rolls back: stock is reserved and a confirmation sent for an order that order-service never saved. The fire-and-forget call also hides the opposite failure - if the broker is down, emit fails silently, the order commits, and no consumer ever hears about it.",
      "suggestion": "Use a transactional outbox: write the event into an outbox table in the same transaction that saves the order, and let a separate relay publish committed rows and mark them sent. That makes publication as atomic as the write and survives a broker outage, at the cost of one more table, a relay process, and at-least-once delivery, so consumers must be idempotent. Short of that, at minimum await the emit and publish only after the transaction has returned.",
      "confidence": 0.93,
      "evidence": [
        "await this.dataSource.transaction(async (manager) => {",
        "this.broker.emit('order.placed', {"
      ],
      "verification": { "status": "verified", "note": "emit call is inside the transaction callback and its result is not awaited or subscribed with an error handler." }
    },
    {
      "id": "F02",
      "file": "services/order-service/src/application/commands/place-order.handler.ts",
      "side": "new",
      "line_start": 19,
      "line_end": 20,
      "severity": "medium",
      "category": "ddd-boundaries",
      "summary": "Application layer depends directly on TypeORM and the persistence entity",
      "rationale": "The handler imports DataSource from typeorm and OrderEntity from the infrastructure layer and performs the save itself, so the application layer depends on the ORM and on a persistence detail instead of on the aggregate's repository. A schema or ORM change now reaches into use-case code, and this handler cannot be unit tested without a live database, which makes the test that would catch the publish-before-commit bug expensive to write. It also leaves no single place that owns the transaction, which is where the outbox write belongs.",
      "suggestion": "Define an OrderRepository port in the domain layer - save(order: Order) - implement it in infrastructure with TypeORM, and inject it by token so the handler depends on the interface rather than on DataSource. Put the transaction, and the outbox write that goes with it, behind that implementation or a unit-of-work abstraction. The cost is one interface and one adapter per aggregate; the gain is a handler that can be tested against a fake.",
      "confidence": 0.85,
      "evidence": [
        "import { DataSource } from 'typeorm';",
        "await manager.save(OrderEntity, OrderEntity.fromDomain(order));"
      ],
      "verification": { "status": "verified" }
    },
    {
      "id": "F03",
      "file": "services/order-service/src/application/commands/place-order.handler.ts",
      "side": "new",
      "line_start": 22,
      "line_end": 26,
      "severity": "low",
      "category": "api-contract",
      "summary": "Integration event has no shared, versioned contract",
      "rationale": "The payload is an inline object literal published on the string 'order.placed', so nothing types or versions the contract that other services compile against. Adding or renaming a field here is invisible until a consumer deserializes it in production, where it surfaces as a missing property rather than a build failure. The payload also carries no event id or timestamp, so a consumer that wants to deduplicate redeliveries or order events has nothing to key on.",
      "suggestion": "Declare an OrderPlacedV1 type in a shared contracts package, including eventId and occurredAt, and publish through a helper typed on it so producer and consumers break at compile time instead of at runtime. A shared package costs a release step whenever the contract changes, which is the point: the change becomes visible to everyone who depends on it.",
      "confidence": 0.72,
      "evidence": [
        "orderId: order.id,",
        "total: order.total,"
      ],
      "verification": { "status": "verified" }
    }
  ],
  "dropped": [],
  "stats": { "files_reviewed": 1, "files_skipped": [] }
}
